key,value,enabled,notes
regex_ifc_name,(^[A-Z]{3}-{1}[A-Z]{3}[-]{1}[0-9]{5}$)|(^[A-Z]{3}-{1}[A-Z]{2}[-]{1}[0-9]{2}[-]{1}[0-9]{3}[-]{1}[A-Z]{1}$)|(^[A-Z]{3}-{1}[A-Z]{2}[-]{1}[A-Z]{1}[123]{1}[-]{1}[0-9]{3}[-]{1}[A-Z]{1}$)|(^[A-Z]{3}-{1}[A-Z]{2}[-]{1}X{2}[-]{1}[0-9]{3}[-]{1}[A-Z]{1}$)|(^[A-Z]{3}-{1}[A-Z]{3}[-]{1}[0-9]{2}[-]{1}[0-9]{3}[-]{1}[A-Z]{1}$)|(^[A-Z]{3}-{1}[A-Z]{3}[-]{1}[A-Z]{1}[123]{1}[-]{1}[0-9]{3}[-]{1}[A-Z]{1}$)|(^[0-9]{2}[.]{1}[0-9]{3}$)|(^[A-Z]{1}[0-9]{1}[.]{1}[0-9]{3}$)|(^X{2}[.]{1}[0-9]{3}$)|(^[A-Z]{2}[_]{1}[]A-Z]{1}[_]{1}[0-9]{2}$),True,From sheet Tool Format: IfcObject
regex_ifc_type,(^[A-Z]{3}_{1}[A-Z]{1}_{1}.*?[0-9]{3}$),True,From sheet Tool Format: IfcType
regex_ifc_system_code,(.*(?=_[^_]+$)),True,From sheet Tool Format: IfcSystem
regex_ifc_name_code,(?<=[A-Z]{3}\-)([A-Z]{3})(?=\-)|(?<=[A-Z]{3}\-)([A-Z]{2})(?=\-)|(^[0-9]{2})(?=\.[0-9]{3}$)|(^[A-Z]{1}[0-9]{1})(?=\.[0-9]{3}$)|(^X{2})(?=\.[0-9]{3}$)|(.*(?=_[^_]+$)),True,From sheet Tool Format: IfcObject - Extract
regex_ifc_type_code,(?<=[A-Z]{3}\_[A-Z]_)(.*)(?=[0-9]{3}),True,From sheet Tool Format: IfcType - Extract
regex_ifc_system,(\b[A-Z][a-z]*_{1}[0-9]{2}\b),True,Default system naming syntax (not present in Tool Format sheet).
regex_ifc_layer,,False,Optional. Enable and set if you want layer syntax validation.
